ChIJQe3GomKj2zsRrU7Ggi1c4xY, Dr. Amit Tak                                                                                                                   , 092251 09809 , "Plot No 51, opposite Shree Krishna Jewellers, Swapna Nagri, Chattrapati Nagar, Garkheda, Chhatrapati Sambhajinagar, Maharashtra 431009, India"                                                      , clinic   , https://ozoneplusmultispecialityhospital.in/                                                                                  ,    5.0,           64, OPERATIONAL    , general_outreach   , Garkheda   , 2026-07-15, new   ,                  ,                 ,                         , 
ChIJLSVQe3ui2zsRycp600ny1nU, Golden Care Hospital                                                                                                           , 096234 48872 , "Plot No. 5, Shivaji Nagar Rd, near State Bank, Deshmukh Nagar, Laxmi Nagar, Garkheda, Chhatrapati Sambhajinagar, Maharashtra 431009, India"                                                         , clinic   ,                                                                                                                               ,    4.3,           32, OPERATIONAL    , no_digital_presence, Garkheda   , 2026-07-15, new   , justdial         ,                 ,                         , 2026-07-15T06:05:10.443528+00:00
ChIJATjATPuj2zsR5MqlG8t8svs, Smeet Dental Clinic                                                                                                            , 098229 79015 , "Flat No. 1, Yogeshwari Silver Woods Apartments, opposite Mahi, New Usmanpura, Chhatrapati Sambhajinagar, Maharashtra 431005, India"                                                                 , clinic   , https://smeet-dental-clinic.com/                                                                                              ,    5.0,           24, OPERATIONAL    , general_outreach   , Osmanpura  , 2026-07-15, new   ,                  ,                 ,                         , 
ChIJzVhL7iKZ2zsRwc5l3wGJcrA, "Cardio Neuro Care Clinic - Heart Specialist | Neurologist | Angiography Center | EMG, NCV, and 2D Echo Test Center Aurangabad", 098553 58508 , "Matrix buisness center, Kalda Corner, Chetana Nagar, Sindhi Colony, Chhatrapati Sambhajinagar, Maharashtra 431005, India"                                                                           , clinic   , https://www.cardioneurocare.com/                                                                                              ,    4.0,            4, OPERATIONAL    , general_outreach   , Osmanpura  , 2026-07-15, new   ,                  ,                 ,                         , 
ChIJVbJMIH6j2zsRTRG-HhiK5iU, Krushna Clinic                                                                                                                 , 098500 17731 , "Galli No. 4, Main Road, Sanjay Nagar, N 2, Mukundwadi, Chhatrapati Sambhajinagar, Maharashtra 431006, India"                                                                                        , clinic   ,                                                                                                                               ,    4.0,            7, OPERATIONAL    , no_digital_presence, Mukundwadi , 2026-07-15, new   , justdial         ,                 ,                         , 2026-07-15T06:05:16.169628+00:00
ChIJ8QezCvWi2zsRGOMX_-OhJus, Mauli Clinic                                                                                                                   , 094234 56536 , "Plot No.9, Mukundwadi Station road, Jai Bhavani Nagar, Near CIDCO N-4, Kamgar Chowk, Prabodhankar Thakare Nagar, N 2, Cidco, Chhatrapati Sambhajinagar, Maharashtra 431006, India"                  , clinic   ,                                                                                                                               ,    4.6,           11, OPERATIONAL    , no_digital_presence, Mukundwadi , 2026-07-15, new   , justdial         ,                 ,                         , 2026-07-15T06:05:24.236004+00:00
ChIJ6QT7Hvqi2zsRE8VNL__AfZY, Shree Samarth Clinic                                                                                                           , 094227 05115 , "Main Road, Sanjay Nagar, N 2, Mukundwadi, Chhatrapati Sambhajinagar, Maharashtra 431006, India"                                                                                                     , clinic   ,                                                                                                                               ,    5.0,            2, OPERATIONAL    , no_digital_presence, Mukundwadi , 2026-07-15, new   , justdial         ,                 ,                         , 2026-07-15T06:05:36.493901+00:00
ChIJO_CijPSi2zsRVl9jt9f7oBw, Gajanan Clinic                                                                                                                 , 092252 34319 , "B18 N4, Doctor Bhapkar Marg, Kamgar Chowk, Sector N 4, Mukundwadi, Chhatrapati Sambhajinagar, Maharashtra 431003, India"                                                                            , clinic   ,                                                                                                                               ,    4.9,           39, OPERATIONAL    , no_digital_presence, Mukundwadi , 2026-07-15, new   ,                  ,                 ,                         , 
ChIJfVDIRXej2zsRXFEmHomYGuA, Shivam Clinic                                                                                                                  , 088064 32756 , "Galli no - 10, Om Shanti Housing Society, New Mukundwadi Railway Station Rd, Jai Bhavani Nagar, Sector N 4, Cidco, Chhatrapati Sambhajinagar, Maharashtra 431009, India"                            , clinic   ,                                                                                                                               ,       ,             , OPERATIONAL    , no_digital_presence, Mukundwadi , 2026-07-15, new   ,                  ,                 ,                         , 
ChIJC4GdAPOj2zsR7hJwqInoAD8, Shiv Clinic                                                                                                                    , 095451 43187 , "Shop No 1, Jai Bhavani Rd, near Jay, Kamgar Chowk, Prabodhankar Thakare Nagar, N 2, Mukundwadi, Chhatrapati Sambhajinagar, Maharashtra 431006, India"                                               , clinic   ,                                                                                                                               ,    5.0,            2, OPERATIONAL    , no_digital_presence, Mukundwadi , 2026-07-15, new   ,                  ,                 ,                         , 
ChIJHTqjsf6i2zsR_UByoTffGpE, sai clinic                                                                                                                     , 095033 36070 , "Main Rd, Shri Ram Nagar, Ram Nagar, N 2, Cidco, Chhatrapati Sambhajinagar, Maharashtra 431006, India"                                                                                               , clinic   ,                                                                                                                               ,    4.9,           33, OPERATIONAL    , no_digital_presence, Mukundwadi , 2026-07-15, new   ,                  ,                 ,                         , 
ChIJV3Glb_qi2zsR_N2TF27iPwg, Tuljai Clinic                                                                                                                  , 097657 43696 , "V9CG+FRG, Sanjay Nagar, N 2, Cidco, Chhatrapati Sambhajinagar, Maharashtra 431006, India"                                                                                                           , clinic   ,                                                                                                                               ,    4.0,            3, OPERATIONAL    , no_digital_presence, Mukundwadi , 2026-07-15, new   ,                  ,                 ,                         , 
ChIJAwCM_lyj2zsR_sKA-2-Q8mE, New Hair and Skin Clinic in Chhatrapati Sambhajinagar                                                                          , 080109 05043 , "Flat No. 6, 3rd Floor Balaji Tower, Above Vighnharta Jewellers Mukundwadi, Sector 2, Kamgar Chowk, Jai Bhavani Nagar, Jawat, Cidco, Chhatrapati Sambhajinagar, Maharashtra 431005, India"           , clinic   , https://newhairandskinclinic.com/                                                                                             ,    5.0,            4, OPERATIONAL    , general_outreach   , Mukundwadi , 2026-07-15, new   ,                  ,                 ,                         , 
ChIJy41aHv-i2zsRg8qmpyJxUoY, Saraswat Clinic And Diabetes Center                                                                                            , 098506 73092 , "Vitthal Chowk, Ram Nagar, N 2, Cidco, Chhatrapati Sambhajinagar, Maharashtra 431007, India"                                                                                                         , clinic   ,                                                                                                                               ,    5.0,          121, OPERATIONAL    , no_digital_presence, Mukundwadi , 2026-07-15, new   ,                  ,                 ,                         , 
ChIJdY60hK-j2zsRNDT0LN1f-DQ, Trupti Clinic                                                                                                                  , 094044 84522 , "Shop No1jay, No 3, Jai Bhavani Rd, Kamgar Chowk, Prabodhankar Thakare Nagar, N 2, Mukundwadi, Chhatrapati Sambhajinagar, Maharashtra 431006, India"                                                 , clinic   ,                                                                                                                               ,    5.0,            1, OPERATIONAL    , no_digital_presence, Mukundwadi , 2026-07-15, new   ,                  ,                 ,                         , 
ChIJ5ZIRrPui2zsR4fQuOCeoSE4, Santh Rohidas Arogya Kendra - Health center - Savitribai Phule Mahila Ekatma Samaj Mandal                                      , 098817 26374 , "J Sector, Sanjay Nagar, N 2, Mukundwadi, Chhatrapati Sambhajinagar, Maharashtra 431006, India"                                                                                                      , clinic   ,                                                                                                                               ,    4.3,           10, OPERATIONAL    , no_digital_presence, Mukundwadi , 2026-07-15, new   ,                  ,                 ,                         , 
ChIJYx9ToPWi2zsRCFTesicy0l8, Kolte Clinic                                                                                                                   , 095039 63637 , "Jai Bhavani Nagar, Sector N 4, Cidco, Chhatrapati Sambhajinagar, Maharashtra 431006, India"                                                                                                         , clinic   ,                                                                                                                               ,    5.0,           37, OPERATIONAL    , no_digital_presence, Mukundwadi , 2026-07-15, new   ,                  ,                 ,                         , 
ChIJZ4uKm42j2zsR3qWhe6mFRhY, Sai Clinic Dr.umesh bharti                                                                                                     , 086688 25586 , "Shop No.1, Balapur Rd, near Hanuman Temple, Mukundnagar, Mukundwadi, Chhatrapati Sambhajinagar, Maharashtra 431006, India"                                                                          , clinic   ,                                                                                                                               ,    5.0,            7, OPERATIONAL    , no_digital_presence, Mukundwadi , 2026-07-15, new   ,                  ,                 ,                         , 
ChIJG-QgxZSj2zsROhvcT63lCd4, Care Multispeciality and Pediatric Hospital - Diabetic Foot | Heart Specialist | Best Cardiologist Hospital in Sambhajinagar   , 072761 83896 , "Plot number 13, N-2, Cidco, Police Station, Jalna Rd, near Mukundwadi, Sanjay Nagar, N 2, Mukundwadi, Chhatrapati Sambhajinagar, Maharashtra 431006, India"                                         , clinic   , https://caremultispecialityandpediatrichospital.com/                                                                          ,    4.9,          104, OPERATIONAL    , general_outreach   , Mukundwadi , 2026-07-15, new   ,                  ,                 ,                         , 
ChIJswqyOJSj2zsRX4cGAYru7Yc, Sai Clinic                                                                                                                     , 082753 25629 , "2, Raj Nagar, Chhatrapati Sambhajinagar, Maharashtra 431006, India"                                                                                                                                 , clinic   ,                                                                                                                               ,    4.0,            1, OPERATIONAL    , no_digital_presence, Mukundwadi , 2026-07-15, new   ,                  ,                 ,                         , 
ChIJgwLLvPui2zsRpJGmssLpJXw, Dr Mahendra Gaikwad's Homoeopathic Health Clinic                                                                               , 092268 93784 , "Sanjay Nagar, N 2, Cidco, near Dr Babasaheb Ambedkar Statue, near Anand Buddha Vihar, Sanjay Nagar, N 2, Mukundwadi, Chhatrapati Sambhajinagar, Maharashtra 431006, India"                          , clinic   , http://www.drmahendragaikwad.com/                                                                                             ,    4.9,          464, OPERATIONAL    , general_outreach   , Mukundwadi , 2026-07-15, new   ,                  ,                 ,                         , 
ChIJAWcnrv6j2zsRLrpknt1xlMc, Morya Medical Store                                                                                                            , 082750 71170 , "Shop No1near A1one Hotel Mukundwadi, Sanjay Nagar, N 2, Mukundwadi, Chhatrapati Sambhajinagar, Maharashtra 431006, India"                                                                           , clinic   ,                                                                                                                               ,    5.0,            1, OPERATIONAL    , no_digital_presence, Mukundwadi , 2026-07-15, new   ,                  ,                 ,                         , 
ChIJnbY8vWaj2zsR1oZsa6aUt9U, "Tanpure Interior and Constructions Pvt Ltd - Interior Designer, Architect in Sambhajinagar"                                   , 096732 91000 , "Office no 23, Second Floor, Tapadiya Cine complex, Town Centre, N 1, Cidco, Chhatrapati Sambhajinagar, Maharashtra 431003, India"                                                                   , architect, https://www.tanpureinterior.com/                                                                                              ,    5.0,          246, OPERATIONAL    , general_outreach   , Cidco      , 2026-07-14, new   ,                  ,                 ,                         , 
ChIJ17_G1Oyi2zsRcBz9CYJJuvk, "Abhishek Salunke Architects -Top Architect in Aurangabad, Sambhajinagar | Best Interior Designer in Aurangabad, Sambhajinagar", 095115 54444 , "Kailash Arcade, opposite to Quadrangle Book Store, CIDCO Cannought, Connaught Place, Chhatrapati Sambhajinagar, Maharashtra 431003, India"                                                          , architect,                                                                                                                               ,    4.8,           98, OPERATIONAL    , no_digital_presence, Cidco      , 2026-07-14, new   , justdial         ,                 ,                         , 2026-07-15T05:59:39.221807+00:00
ChIJB5GycJuj2zsR_-VQT8gr7AA, Jyotirmaya Architects                                                                                                          , 078430 08495 , "Office No. 01, Krushnakunja, Garkheda Parisar Rd, near Gokul Sweets, Parijat Nagar, Sector N 4, Cidco, Chhatrapati Sambhajinagar, Maharashtra 431006, India"                                        , architect, https://www.jyotirmayarchitects.co.in/                                                                                        ,    4.9,          102, OPERATIONAL    , general_outreach   , Cidco      , 2026-07-14, new   ,                  ,                 ,                         , 
ChIJK-s2XhCj2zsRLDgSm1j1ooQ, Greenedge Architects & Designers                                                                                               , 070301 53884 , "Plot no.07, water tank, F-2, chowk to high court road, near Pundlik Nagar Road, Sector F-1, Hanuman Nagar, Sector N 4, Cidco, Chhatrapati Sambhajinagar, Maharashtra 431009, India"                 , architect, https://www.instagram.com/greenedge.architects/                                                                               ,    5.0,           76, OPERATIONAL    , general_outreach   , Cidco      , 2026-07-14, new   ,                  ,                 ,                         , 
ChIJ_QXkOwCj2zsRnxHCjwQDMGM, The Century Architects                                                                                                         , 077093 34499 , "opposite NOBLE NURSING HOSPITAL, Kamgar Chowk, Sector N 4, Cidco, Chhatrapati Sambhajinagar, Maharashtra 431003, India"                                                                             , architect,                                                                                                                               ,    5.0,           21, OPERATIONAL    , no_digital_presence, Cidco      , 2026-07-14, new   , justdial         ,                 ,                         , 2026-07-15T05:59:49.042616+00:00
ChIJr_O6S6ai2zsReFLIambQEUU, Arfaizu Architects                                                                                                             , 098885 30555 , "Zia Casa, Plot No 42, Aurangabad Times Colony, N 10, Cidco, Chhatrapati Sambhajinagar, Maharashtra 431001, India"                                                                                   , architect, http://www.arfaizu.com/                                                                                                       ,    4.8,           58, OPERATIONAL    , general_outreach   , Cidco      , 2026-07-14, new   ,                  ,                 ,                         , 
ChIJKW3QIaqj2zsRjPZkYsc_-hE, Trimiti Architect - Top Architect in Aurangabad | Best Interior designer in Aurangabad                                         , 072183 59658 , "Sonchafa Building, Prerna, Malhar Chawk, Pundlik Nagar Rd, Chhatrapati Nagar, Chattrapati Nagar, Garkheda, Chhatrapati Sambhajinagar, Maharashtra 431009, India"                                    , architect, https://trimitiarchitect.com/                                                                                                 ,    5.0,           68, OPERATIONAL    , general_outreach   , Cidco      , 2026-07-14, new   ,                  ,                 ,                         , 
ChIJhYK4byij2zsR4RnBI__pTW8, DEORA ASSOCIATES                                                                                                               , 098230 99927 , "opposite Opp Asawa Brothers Library, N3-177A, Kamgar Chowk, N 3, Cidco, Chhatrapati Sambhajinagar, Maharashtra 431003, India"                                                                       , architect,                                                                                                                               ,    4.9,           38, OPERATIONAL    , no_digital_presence, Cidco      , 2026-07-14, new   , justdial         ,                 ,                         , 2026-07-15T05:59:55.236257+00:00
ChIJlzlumMuj2zsRDSjcV4gU9I4, Homely Architects & Interior designers                                                                                         , 088558 55088 , "Palwe hospital building Jaybhavani chauk, Parijat Nagar, Sector N 4, Cidco, Chhatrapati Sambhajinagar, Maharashtra 431009, India"                                                                   , architect, http://thehomely.design/                                                                                                      ,    5.0,           13, OPERATIONAL    , general_outreach   , Cidco      , 2026-07-14, new   ,                  ,                 ,                         , 
ChIJByw2F_Ki2zsRIdjDIumdXlI, ECO DESIGN ARCHITECTS                                                                                                          , 094036 82767 , "c/o. DIPA ENTERPRISES, Plot no. 10, N-2 CIDCO,, Jalna Road,, Kamgar Chowk, Mayanagar Colony, N 2, Cidco, Chhatrapati Sambhajinagar, Maharashtra 431006, India"                                      , architect,                                                                                                                               ,    4.7,           18, OPERATIONAL    , no_digital_presence, Cidco      , 2026-07-14, new   , justdial         ,                 ,                         , 2026-07-15T06:00:01.647132+00:00
ChIJ6UFrtJ-j2zsRs_baOUOUt-U, Architect Ejaz Shaikh | JW Studio.                                                                                             , 075880 76537 , "7A, near Arish Masjid, beside Panchayat Samiti Office, Arish Colony, N 10, Cidco, Chhatrapati Sambhajinagar, Maharashtra 431001, India"                                                             , architect,                                                                                                                               ,    4.6,           11, OPERATIONAL    , no_digital_presence, Cidco      , 2026-07-14, new   , justdial         ,                 ,                         , 2026-07-15T06:00:06.996093+00:00
ChIJJ0IcllO92zsR5nGBf_7-3vQ, STUDIO ARCHITECTS                                                                                                              , 095450 00534 , "Tower, N, AL- ZAINAB, 11, Harsul Rd, beside Click Hotel, Hudco, Yadav Nagar, Sector L, Cidco, Chhatrapati Sambhajinagar, Maharashtra 431003, India"                                                 , architect,                                                                                                                               ,    4.8,           42, OPERATIONAL    , no_digital_presence, Cidco      , 2026-07-14, new   , justdial         ,                 ,                         , 2026-07-15T06:00:17.111654+00:00
ChIJnRbdVMei2zsRk_1krJ1nNfg, Sthapati Planners & Developers Pvt. Ltd                                                                                        , 091584 75253 , "National Sample Survey office, opp. Garware Road, N 7, Cidco, Chhatrapati Sambhajinagar, Maharashtra 431003, India"                                                                                 , architect, http://www.sthapati.biz/                                                                                                      ,    4.7,           18, OPERATIONAL    , general_outreach   , Cidco      , 2026-07-14, new   ,                  ,                 ,                         , 
ChIJM8zWI9ij2zsRuQ834uGSZ3A, Shreya Mahajan Architects                                                                                                      , 078208 43061 , "Plot No. 63, Pundlik Nagar Rd, Parimal Housing Society, Vishalnagar, Garkheda, Chhatrapati Sambhajinagar, Maharashtra 431009, India"                                                                , architect,                                                                                                                               ,    4.9,           24, OPERATIONAL    , no_digital_presence, Cidco      , 2026-07-14, new   , justdial         ,                 ,                         , 2026-07-15T06:00:23.011416+00:00
ChIJl-wq4naY2zsRxVY8jJVtmJE, Portico Design Concepts                                                                                                        , 0240 234 5055, "New Balaji Nagar, Sindhi Colony, Chhatrapati Sambhajinagar, Maharashtra 431005, India"                                                                                                              , architect, https://portico.co.in/                                                                                                        ,    4.8,           41, OPERATIONAL    , general_outreach   , Cidco      , 2026-07-14, new   ,                  ,                 ,                         , 
ChIJVVVVFeyi2zsR3azosAx3z5w, "Veerkar and Associates, Anand N Veerkar"                                                                                      , 098223 73326 , "Swamidham, plot no6, A, opposite fresh o fram, Bhakti Nagar, N 1, Cidco, Chhatrapati Sambhajinagar, Maharashtra 431006, India"                                                                      , architect,                                                                                                                               ,    5.0,            1, OPERATIONAL    , no_digital_presence, Cidco      , 2026-07-14, new   , justdial         ,                 ,                         , 2026-07-15T06:00:30.370652+00:00
